# VERLAUF: Mark Jäckels Kommunikation mit Richter Hellenthal (2022-2025)

## **DER BEWEIS: Hellenthal wusste ALLES - und gab das Kind OHNE THERAPIE zur Mutter**

---

## **CHRONOLOGISCHE DOKUMENTATION**

### **09.09.2022 - ERSTES DOKUMENT: Stellungnahme zum EASO-Antrag**
**Dokument:** `2022-09-09_Jäckel_AG-Saarbrücken_Beantwortung_der_Fragen_des_Gerichts-Rekonstruktion_Kindeswohlgefährdung.txt`

**An:** Richter Hellenthal, AG Saarbrücken
**AZ:** 39 F 221/22 EASO
**Umfang:** 1.157 Zeilen

#### **KERNAUSSAGEN:**

1. **ALKOHOLPROBLEMATIK DER MUTTER - DETAILLIERT DOKUMENTIERT:**
   - "Die Kindesmutter trinkt äußerst gern und viel Alkohol" (Zeile 48)
   - **Fotos von 2020-2022** als Beweismittel beigefügt
   - Systematische Dokumentation: Verwüstete Wohnungen, Nicolas unbeaufsichtigt, Mutter bewusstlos

2. **SCHWERWIEGENDSTER VORFALL:**
   - **Dezember 2021:** Glasscherbe im Fuß des zweijährigen Nicolas (Zeilen 707-711)
   - Vater auf Dienstreise in Österreich
   - Mutter hatte Alkoholabsturz, ließ Glasflaschen fallen
   - Kind verletzte sich an Scherben

3. **MARK'S ZENTRALE FORDERUNG - THERAPIE:**
   > "Mutter hat Trinkverhalten reflektiert und einer **Therapiemaßnahme zum nächstmöglichen Zeitpunkt** zugestimmt." (Zeile 277-280)

   **Aber:** "Seit 11.05.22 jedoch keine Krankheitseinsicht mehr und lehnt professionelle Hilfe wieder ab." (Zeile 283-285)

4. **JUGENDAMT HÖRT NICHT ZU:**
   - "Mir wurde in den vergangenen drei Monaten nicht einmal die Chance eingeräumt, das was ich die letzten drei Jahre durchgemacht habe zu vermitteln." (Zeilen 145-147)
   - "Selbst als ich sagte, dass es noch eine andere Seite von Frau K. gibt, die ich mit Bildbeweisen oder Sprachnachrichten belegen kann, bekomme ich Antworten wie „spammen sie mich nicht zu"." (Zeilen 143-145)

5. **SPRACHNACHRICHTEN ALS BEWEIS:**
   - Mark bietet an: Sprachnachrichten der Mutter, die zeigen dass sie weiterhin trinkt
   - **Zitat der Mutter:** "Der [von Jugendamt] hat gesagt ich brauche keine Therapie – deswegen!" (Zeilen 116-117)

6. **MARK'S DRINGLICHER APPELL:**
   > "Dass im schlimmsten Fall ohne mein Eingreifen, Nicolas hätte schwer verletzt werden können, weiß das Jugendamt nicht, weil es mir kein Gehör schenkt." (Zeilen 147-149)

---

### **2023: Mark bleibt dran - Jugendamt manipuliert**

#### **05.01.2023 - Email-Austausch mit Kuhn**
**Dokument:** `2023-01-05_Jäckel_RVS-JA_Kuhn_Email-Austausch-Besuchskontakte.txt`

Mark konfrontiert Kuhn:
- Feedback zu Praksys steht aus
- "BRANDWUNDE AM HALS? WURDE DIE FRAU DAZU BEFRAGT? WARUM STANK DAS KIND SO?"
- Kuhn antwortet ausweichend

#### **10.01.2023 - Telefonat mit Kuhn**
**Dokument:** `2023-01-10_RVS-JA_Kuhn_Telefonat-Umgangsregelung_39F221-22.txt`

**KRITISCH:** Kuhn erfährt **spätestens** hier von PRAKSYS-Manipulation durch Klein/Wilhelm.

#### **21.09.2023 - Beschwerde gegen Urteil EASO**
**Dokument:** `2023-09-21_Jäckel_AG-Saarbrücken_Beschwerde_gegen_Urteil_EASO_F39_239-23.txt`

Mark wiederholt seine Position:
- Alkoholproblematik der Mutter
- Systematische Verleumdung durch Jugendamt
- **Forderung: Therapie und Schutz für Nicolas**

---

### **09.01.2024 - AUSFÜHRLICHSTE DARSTELLUNG: 10-seitiges FAX**
**Dokument:** `2024-01-09_Jäckel_AG-Saarbrücken_Ausführliche-Sachverhaltsdarstellung_Jugendamt-SB_FAX01.txt` + FAX02

**An:** Familiengericht Saarbrücken
**Umfang:** 910 Zeilen (10 Seiten)

#### **KERNAUSSAGEN:**

1. **SYSTEMATISCHE MANIPULATION DURCH JUGENDAMT:**
   - Detaillierte Widerlegung aller Vorwürfe von Nina Meiser
   - "Pausenclown"-Vorfall (14.09.2022): Schnetti verhindert dass Mark sprechen kann
   - Meiser's Lügen: "Als Hure beschimpft" - FALSCH
   - Meiser's Lügen: "Drei Handys" - FALSCH

2. **GLASSCHERBE IM FUß (DEZEMBER 2021) - ERNEUT GESCHILDERT:**
   > "*Scherbe von Bierflasche im Fuß des eigenen zweijährigen Kindes durch fallengelassene Flaschen während eines Alkoholabsturz der Mutter, während Vater auf Dienstreise in Österreich ist" (Zeilen 43-46, FAX02)

3. **MARK'S VERZWEIFLUNG:**
   > "Ich habe sehr lange gebraucht, das hier zu greifen, ist es doch das bisher willkürlichste unmenschlichste und schmerzvollste Ereignis, was ich in bis dato 42 Jahren erleben musste." (Zeilen 48-50, FAX02)

4. **TÄTER-OPFER-UMKEHR:**
   > "Das Opfer muss zum Täter werden, dass die Ignoranten die Helden bleiben." (Zeilen 108-109, FAX02)

---

### **12.02.2024 - Widerlegung Gewaltschutzbeschluss**
**Dokument:** `2024-02-12_Widerlegung_Gewaltschutzbeschluss.txt`

Mark stellt klar:
- Gewaltschutz ist "eine effektiv platzierte Schikane für laufende Sorgerechtsangelegenheiten mit grundlegend fehlender Notwendigkeit" (Zeilen 99-102)
- Ihm wurde nie die Möglichkeit gegeben, sich zu äußern

---

### **08.10.2024 - EILANTRAG: Verdacht auf Misshandlung**
**Dokument:** `2024-10-08_FG_Eilantrag_Untersuchung_Nicolas_{Kindeswohlgefaehrdung}.txt`

**An:** Richter Hellenthal
**Datum:** 08.10.2024 (einen Tag nach Besuch am 07.10.2024)

#### **KERNAUSSAGEN:**

1. **SCHWERWIEGENDE VERLETZUNGEN AM ARM:**
   > "bei unserem letzten Zusammentreffen am Montag, den 07.10.2024, ist mir eine schwerwiegende Verletzung am linken Arm meines Sohnes aufgefallen, die das **Aussehen von ausgedrückten Zigaretten** hat." (Zeilen 27-29)

2. **NICOLAS WEICHT AUS:**
   > "Wenn ich meinen Sohn frage, was passiert ist, weicht er aus, als hätte er Angst, etwas zu sagen." (Zeilen 38-39)

3. **DRINGLICHER APPELL:**
   > "Unter diesen Umständen bitte ich Sie, **u n v e r z ü g l i c h** eine staatlich unabhängige ärztliche Untersuchung meines Kindes zu veranlassen, um mögliche Misshandlungen aufzuklären und weiteren Schaden abzuwenden." (Zeilen 41-43)

4. **BEWEISE ÜBERMITTELT:**
   > "Beweisaufnahmen wurden bereits am Morgen des 08.10.2024 via Fax dem Gericht übermittelt" (Zeilen 70-71)

---

### **14.10.2024 - PRAKSYS-BERICHT: Die Falle schnappt zu**
**Dokument:** `2024-10-14_Praksys_IRIS_Klein_Gericht_20251201_122828.txt`

**PRAKSYS BEHAUPTET (GELOGEN):**
> "Heute sieht man gut, dass das Kind sich die Stiche am Arm aufgekratzt hat. Als ich kurz abgelenkt war, macht der Vater schnell ein Foto von dem Arm." (Zeilen 110-116)

> "Das Kind erzählt, dass es Mückenstiche hat und sich den Arm gekratzt hat."

**WAHRHEIT:**
- Dieses Gespräch hat NIE stattgefunden
- Nicolas zeigte ausweichendes Verhalten (vermied Augenkontakt, wollte nicht erklären)
- Mark machte Foto als besorgter Vater am **07.10.2024**
- PRAKSYS diffamiert Mark: "heimliches Beweisfoto"

---

### **28.10.2024 - Antrag auf Ortswechsel**
**Dokument:** `2024-10-28_Jäckel-Mark_AG-Hellenthal_Antrag-Ortswechsel-Begleitender-Umgang_39F239-23.txt`

**An:** Richter Hellenthal
**Datum:** 27.10.2024

Mark kann nicht mehr zu PRAKSYS:
- PRAKSYS-Bericht vom 14.10.2024 enthält "bewusst unwahre Aussagen"
- Systematische Schikane (Foto-Verbot nach 40 Wochen, rückwirkende Vorwürfe)
- **Kuhn hatte bereits im Dezember 2022 gelogen** (wird dokumentiert)

> "Ich werde die Verfasserin wegen Verleumdung anzeigen, weil (erneut) ein falsches Bild von mir dem Gericht (erneut) präsentiert wurde." (Zeilen 96-97)

---

### **16.07.2025 - KUHN'S VOLLKOMMENE ABSOLUTION: Kind zur Mutter OHNE THERAPIE**
**Dokument:** `2025-07-16_JA-Regionalverband_Kuhn_Stellungnahme-Therapieerfolg_39F1-25.txt`

**Von:** Lena Kuhn, Jugendamt Regionalverband Saarbrücken
**An:** Amtsgericht Saarbrücken - Familiengericht
**AZ:** 39 F 1/25 HK

#### **KERNAUSSAGEN:**

1. **KEINE ALKOHOLTHERAPIE - NUR "INTEGRATIVE FAMILIENHILFE":**
   > "Die Kindesmutter befindet sich seit dem 10.02.2025 mit Nicolas in einer **teilstationären Jugendhilfemaßnahme**. Die **integrative Familienhilfe** des Margaretenstiftes wurde seitens des Sozialen Dienstes als die geeignete Hilfeform für Nicolas und die Kindesmutter angesehen." (Zeilen 23-26)

2. **"SCHUTZKONZEPT" STATT THERAPIE:**
   > "Gemeinsam mit der Kindesmutter wurde ein **Schutzkonzept** erarbeitet, welches sie bis dato eingehalten hat." (Zeilen 27-28)

3. **HILFE "ERFOLGREICH BEENDET":**
   > "Im Rahmen der Hilfe arbeitete die Kindesmutter zuverlässig, regelmäßig und motiviert mit, sodass diese Hilfe zum **31.07.2025 erfolgreich beendet werden kann**" (Zeilen 28-30)

4. **KEINE ALKOHOLTHERAPIE ERWÄHNT:**
   - **NUR:** "negative Testergebnisse betreffend den Alkoholkonsum" (Zeilen 35-36)
   - **NUR:** "Im Dezember hat erneut ein Testungstermin stattgefunden, welcher negativ war" (Zeilen 105-106)

5. **VOLLKOMMENE ABSOLUTION:**
   > "**Derzeit gibt es keine Anhaltspunkte für eine Kindeswohlgefährdung durch die Kindesmutter.**" (Zeilen 110-112)

---

## **DIE KATASTROPHALE BILANZ:**

### **Was Mark von Anfang an forderte (09.09.2022):**
✓ Alkoholtherapie für die Mutter
✓ Schutz für Nicolas
✓ Anerkennung der Gefährdung

### **Was Hellenthal wusste:**
✓ Detaillierte Dokumentation der Alkoholproblematik (Fotos 2020-2022)
✓ Glasscherbe im Fuß des Kindes (Dezember 2021)
✓ Systematische Manipulation durch Jugendamt
✓ PRAKSYS-Lügen (Oktober 2024)
✓ Verdacht auf Misshandlung (Oktober 2024)
✓ Mark's durchgehende Warnungen über 3 Jahre

### **Was am 16.07.2025 geschah:**
✗ **KEINE Alkoholtherapie für die Mutter**
✗ Nur "integrative Familienhilfe" und "Schutzkonzept"
✗ Kind zur Mutter gegeben basierend auf **negativen Tests** (die Mark schon 2022 als unzureichend kritisierte)
✗ Kuhn's Absolution: "keine Anhaltspunkte für Kindeswohlgefährdung"

---

## **DIE VERNICHTENDE FRAGE:**

**Wenn Hellenthal am 06.11.2025 behauptet, Mark's Dokument vom "29.10.2024" würde nicht existieren...**

**...warum kennt er dann nicht die HUNDERTE von Seiten, die Mark ihm zwischen 09.09.2022 und 28.10.2024 geschickt hat?**

### **Oder noch schlimmer:**

**Hellenthal kannte ALLES - und gab das Kind trotzdem zur Mutter OHNE THERAPIE.**

---

## **ANLAGEN-ÜBERSICHT:**

1. **2022-09-09** - Erste Stellungnahme (1.157 Zeilen) + Foto-Dokumentation
2. **2024-01-09** - FAX (910 Zeilen, 10 Seiten)
3. **2024-02-12** - Widerlegung Gewaltschutz
4. **2024-10-08** - Eilantrag Untersuchung Nicolas
5. **2024-10-28** - Antrag Ortswechsel PRAKSYS
6. **2025-07-16** - Kuhn Stellungnahme (KEINE THERAPIE)
7. **evidence/kuhn_mückenstiche.jpg** - Foto der Verletzungen vom 07.10.2024

---

**Erstellt:** 01.12.2025
**Für:** Antwort auf Hellenthal-Stellungnahme vom 06.11.2025
